{
  "$schema": "https://json-schema.org/draft/2020-12/schema",
  "$id": "https://example.org/skill-registry/manifest.schema.json",
  "title": "SkillManifest v1",
  "type": "object",
  "required": ["skill_id", "version", "name", "description", "publisher", "execution_modes"],
  "properties": {
    "skill_id": {
      "type": "string",
      "pattern": "^[a-z0-9][a-z0-9._-]*(/[a-z0-9][a-z0-9._-]*)+$",
      "description": "publisher/skill-name"
    },
    "version": {
      "type": "string",
      "pattern": "^(0|[1-9][0-9]*)\\.(0|[1-9][0-9]*)\\.(0|[1-9][0-9]*)([-+].*)?$"
    },
    "name": { "type": "string", "minLength": 1 },
    "description": { "type": "string", "minLength": 1 },
    "publisher": {
      "type": "object",
      "required": ["id"],
      "properties": {
        "id": { "type": "string", "minLength": 1 },
        "verified": { "type": "boolean", "default": false },
        "official": { "type": "boolean", "default": false }
      },
      "additionalProperties": false
    },
    "topics": { "type": "array", "items": { "type": "string" }, "default": [] },
    "tags": { "type": "array", "items": { "type": "string" }, "default": [] },
    "pack": { "type": ["string", "null"], "default": null },
    "execution_modes": {
      "type": "array",
      "minItems": 1,
      "items": { "enum": ["instruction", "tool", "workflow", "executable"] }
    },
    "compatibility": {
      "type": "object",
      "properties": {
        "agent_classes": { "type": "array", "items": { "type": "string" }, "default": [] },
        "harnesses": { "type": "array", "items": { "type": "string" }, "default": [] }
      },
      "additionalProperties": false,
      "default": {}
    },
    "input_schema": { "type": "object", "default": {} },
    "output_schema": { "type": "object", "default": {} },
    "tool_dependencies": { "type": "array", "items": { "type": "string" }, "default": [] },
    "permissions": {
      "type": "object",
      "properties": {
        "network": { "type": "boolean", "default": false },
        "filesystem": { "enum": ["none", "read-only", "read-write"], "default": "none" }
      },
      "additionalProperties": false,
      "default": {}
    },
    "trust": {
      "type": "object",
      "properties": {
        "official": { "type": "boolean", "default": false },
        "audited": { "type": "boolean", "default": false },
        "audit_ref": { "type": ["string", "null"], "default": null },
        "revoked": { "type": "boolean", "default": false }
      },
      "additionalProperties": false,
      "default": {}
    },
    "integrity": {
      "type": "object",
      "properties": {
        "sha256": { "type": ["string", "null"], "default": null }
      },
      "additionalProperties": false,
      "default": {}
    },
    "cache": {
      "type": "object",
      "properties": {
        "ttl_seconds": { "type": "integer", "minimum": 0, "default": 3600 },
        "pin_recommended": { "type": "boolean", "default": false }
      },
      "additionalProperties": false,
      "default": {}
    },
    "deprecation": {
      "type": "object",
      "properties": {
        "deprecated": { "type": "boolean", "default": false },
        "replaced_by": { "type": ["string", "null"], "default": null }
      },
      "additionalProperties": false,
      "default": {}
    },
    "popularity": { "type": "integer", "minimum": 0, "default": 0 },
    "updated_at": { "type": ["string", "null"], "default": null },
    "artifact": {
      "type": "object",
      "properties": {
        "instruction": { "type": ["string", "null"], "default": null },
        "tool_ref": { "type": ["string", "null"], "default": null },
        "files": {
          "type": "array",
          "default": [],
          "items": {
            "type": "object",
            "required": ["path", "sha256", "size"],
            "properties": {
              "path": { "type": "string" },
              "sha256": { "type": ["string", "null"] },
              "size": { "type": "integer", "minimum": 0 }
            },
            "additionalProperties": false
          }
        }
      },
      "additionalProperties": false,
      "default": {}
    }
  },
  "additionalProperties": false
}
